label,fitur
1,pembajakan akun aplikasi telegram pemulihan kunci mengaktifkan verifikasi langkah telegram whatsapp fitur verifikasi langkah aplikasinya telegram
1,betapa malang bangsa dikelola bandit duh betapa malang bangsa dikelola bandit
0,menteri susi sediakan bu aksi tirto langsung menghubungi susi menyewakan bu rombongan peserta aksi ciami pangandaran susi singkat
1,love saudaraku salib love saudaraku salib berhati hatilah zaman now ingatkan saudara
1,ariekuntung anak bermigrasi gurun suriah jordan anak th bermigrasi gurun dr suriah jordan ditemukan unhcr hni bw ta pakaian adiknya yg terbunuh suriah
0,berminat anggota pki silahkan daftarkan berminat anggota pki silahkan daftarkan anggota pki anggota
1,polisi israel mencekik anak palestina mati sabtu demonstrasi kedutaan amerika pindah yerusalem polisi israel mencekik anak palestina mati sabtu demonstrasi kedutaan amerika pindah yerusalem anak lelaki bersalah membaca kalimat syahadat meningg usaha kelompok mengupload video you tube konsisten dihapu you tube googl face book silahkan teruskan video viral mencapai media
0,ani baswedan penista agama remisi ani baswedan penista agama remisi tolong kemenkumhan pikirkan
1,sandiaga uno ijinkan fpi razia natal siapkah mati lawan mata tunggu unjuk tare hancurkan khilafah tegakkan nkri tegakkan pancasila kibarkan bendera merah putih
1,nama gubernur bali dicatut seminar pesona wisata halal selamat malam krama bali menyayangkan beredarnya gambar klarifikasi satupun agenda keynot speaker pesona wisata halal menghimbau menyelenggrakan koreksi secepatnya menimbulkan kegaduhan masyarakat terimakasih
1,iriana kalung raja salman diserahkan kpk kalung berlian pemberian raja salman iriana jokowi diserahkan kpk
1,coca cola pepsi cola minuman arak minum arak jeni sekila info anggota intel sholat dgn tugaskan menyamar olah melayu kristen masuk vatican pendeta kristen gembira orang melayu masuk kristen ambil anak angkat ketua pendeta vatican vatican
0,audiensi masyrakat anti hoax kapolri kapolri kemarin komunita masyarakat anti hoax beraudiensi beliau berterimakasih muncul jalan kekacauan timbul akibat penyebaran hoax medso kadang brutal
0,harga dage murah singapura dki jakarta singapura peternakan sapi harga dage sapinya murah jakarta konyol tuh gubernur mengerti sandiaga umj tangerang selatan selasa
1,meme bertuliskan eiit sunat gak nyalon gubernur diunggah akun facebook ani baswedan sandiaga uno eiit sunat gak nyalon gubernur
1,foto personil act meningg mohon doanya meningg dunia saudara membawa dana bantuan obat an tim dokter barang indonesia suriah krn terkena bom semoga alm syahid allah terima amal ibadahnya ampuni dosanya istri anak ditinggalkan ketabahan kesabaran amin ya rab
1,tuga prabowo presiden jokowi bubarkan fpi basmi kadal gurun prabowo tuga jokowi tuga pertamamu bubarkan fpi basmi kadal gurun prabowo
1,foto tanah longsor tol ungaran semarang menutup badan jalan semarang tanah longsor tol ungaran semarang menutup badan jalan pengendara bawen kota semarang exit tol ungaran penanganan peristiwa sabtu malam hujan turun lokasi tepatnya km lajur ungaran semarang jalan langsung tertutup sepenuhnya
1,info nya orang kabur dr kontrakan nya link lebak indah desa lebak gede assalamualaikum warohmatullahi wabarokatuh info nya orang kabur dr kontrakan nya link lebak indah desa lebak gede sktr jm bakaran ikan link sawah lebak gede a menantu a s s k saudara nya berhati krn penyakit tdk kelurahan lebak gede zona merah smoga saudara sllu lindungi allah swt aamiin ya rabbal alamiin
1,bioskop palangka raya buka persebaran covid gimana gak menyebar lua penularan covid palagka raya infonya bioskop xxi buka wkwkwkwkwk gilaaaaaaaaa
1,perampokan bersenjata ranch market pondok indah guy ati ya temennya dyna temen gw rampok dalem supermarket ranch market pondok indah
1,ex napi wagub drun ex napi thn jd wagub bijimana ni drun sahhhhh
1,grati layanan netflix kerja rumah netflix grati karantina sisa akun selamat menang
1,corona mudah diatasi presiden china camkan corona mudah diatasi presiden china camkan
1,muncul pesan gejayancarirecehan atasnamakan bem ugm presiden bem km ugm angkat bicara resmi bem km ugm informasi sm kali minggu muncul sm nama bem km ugm mengajak mendukung ruu kpk sikap menolak ruu kpk
1,dituntut nasabah kehilangan dana rp triliun bank mandiri bantahan corpor secretari bank mandiri rohan hafa informasi hoak aliran dana melibatkan bank indonesia ojk dipantau ppatk
1,lari jaket cepat kuru nasehat kawan kawan paskibraka enrekang pasukan inti skrg beliau tentara berpangkat perwira ngasih masukan biar cepat kuru lari pake jaket celana jam siang terik matahari
1,voucher grati go pay rp ribu line gopay rp grati silahkan buka voucher
0,klarifikasi huma pemprov ntb terkait kabar gurbenur zulkifliemansyah selamat prabowo sandi mengecam berita bohong hoak gubernur beredar media sosial berita hoak akun palsu fb zulkieflimansyah gubernur ucapan selamat salah calon presiden ri
1,foto panwaslu malaysia yaza azzahra berpos jari relawan keterangannya tvone janggal beredar foto panwaslu malaysia yaza azzahra berpos jari relawan
1,hasil perhitungan diluar negri luarbiasa cebong bilang hoax link updat harap bersabar updat perhitungan selesai hasil perhitungan diluar negri luarbiasa
1,mari lihat prabowo sandiaga uno mari lihat prabowo sandiaga uno sumber terpercaya membocorkan pencapresan prabowo kekuatan ase pengen melahap indonesia
0,guru tk malaysia terekam aniaya muridnya ditangkap hati hati memilih tk anak anak
0,kemendagri mengeluarkan mengedarkan surat pembekalan cpn surat hoax surat palsu
1,pertalit rp liter zaja kemarin si kupe ruhutsitompul puji hey diam harga pertalit rp rp liter
1,mall ciputra semarang adakan nikah masal grati nikah bareng mall ciputra stop pacaran ayo menikah full fasilita mahar seperangkat alat sholat biaya nikah bingkisan manten ria busana dokumentasi pengantin grati terbuka
1,donor sperma fakulta kedokteran universita indonesia donor sperma workshop iui tanggal desemb gedung imeri fkui fee ribu makan siang ok dibutuhkan orang donor temen cowonya sekolah kerja or main daerah salemba fkui mohon bantuan sumbangannya ya cp eli whatsapp and call penyelenggara ina reprom indonesian reproduct medicin research and train center fkui share would be realli much appreci thank in advanc guy better than wast it in ur bathroom
1,poll perppu orma gibran rakabum perppu orma otorit
1,aksi damai penolakan pembangunan gereja sekolah santa laurensia aksi damai penolakan pembangunan gereja sekolah santa laurensia
1,penjelasan menko polhukam isu politik terkini penjelasan menko polhukam isu politik terkini
0,foto pemandangan kota damasku suriah foto pemandangan kota damasku suriah
1,jembatan kaca cina jatuh hancur membawa bencana china jang jia jie jembatan kaca jatuh hancur membawa bencana
0,polda sulsel sita kg sabu kemasan kopi cina belon sadar peneru bangsa diracuni dihancurkan koloni
0,pengelola bu po npm dipanggil polisi pengelola bu po npm angga vircansa chairul dipanggil ditreskrimum polda metro jaya saksi dugaan makar menyewakan unit unit bu nya peserta aksi sumatera barat pencideraan janji kapolri menghalang halangi pemilik po bu menyewakan unitnya alumni
0,menjamurnya polisi tentara gadungan penyusup penjajah ya
1,gambar peta narasi jakarta zona merah hati ya rumah ngak jakarta zona merah hati ya rumah ngak
1,pasien covid meningg rumah sakit manaf kota jambi pasien covid rs manap meningg skrng persiapan pemakaman a bg lg persiapan orng dipmakaman pall mayat lg dlam prose kremasi
1,foto ariel noah relawan tenaga medi pandemi viru corona covid perawat pasien corona histeri ariel noah relawan tenaga medi
1,jokowi positif corona we berita menggembirakan moga nyata jt rakyat indonesia negara tercintanya selamat dr digadaikanya aamiin
1,orang karangturi balak cawa tertular viru corona bpk orang karangturi balak cawa tertular viru corona plng jepang bw rsi tugu rujuk tglyoso hati bpk jaga keluarga biar du jauhkan viru yg berbahaya
1,penculikan bayi bangil penculik kabur pakai mobil elf warna hitam penculikan bayi rabu tgl januari penculikan bayi bangil korban dr rmh sakit bangil pulang pandaan tepatnya pasar bangil jam siang korban mencari angkutan pandaan mobil elp warna hitam yg berpenumpang org laki perempuan
1,video hancuur hancuuur natalan pakai shalawat aduuuh gw kristen aja risih kek maksa banget sih pake blender emangnya campur sari menghormati menyayangi mix emangnya agama islam kristen muncul remix keberagaman agama ngeliat gw ngakak
1,habib ali al jufri hadiri reuni habib ali bin abdurrohman al jufri dr hadromaut dtng indonesia tabligh akbar acara jakarta beliau ulama dunia yg dakwa eropa insyallah kedatang habib ali indonesia bawa barokah indonesia allahu akbar
1,spanduk warga nahdliyin rindu khilafah milik nu spanduk bertuliskan warga nahdliyin rindu khilafah logo nu nemu foto thn sa ketua pbnu ayoo podho melek nu sing manut mbah hasyim kwi iki do matla ah ben ngerti
1,presiden foto pemakai cadar idak presiden foto pemakai cadar
1,akun instagram palsu menk terawan halo healthi menk terawan agu putranto tdk memiliki akun instagram hati hati ya akun yg mengatasnamakan beliau tau aktivita menk pantengin akun offici kementerian kesehatan twitter kemenkesri instagram facebook
1,ani pilih pembinaan cabut kjp siswa berdemo menggariskan pencabutan hak kjp pembinaan orang tua dipanggil anak dipanggil diajak diskusi dididik
1,dandenpom tangerang mengamankan mobil plat dina yg dipak anggota banser mengaku anggota tni apel pacar nya dandenpom tangerang letkol cpm indra jaya mengamankan mobil plat dina yg dipak orang sipil dperiksa d kantor polisi milit pengendara anggota banser apel pacar nya mengaku anggota tni sespri pejabat milit
1,akibat bermain hp pom bensin sambiroto terbakar menyebabkan anak meningg kebakaran mbl pom bensin sambiroto semarang anaknya mainin hp dlm mbl pa bpknya ngisi bensin pom infonya anaknya meningg dlm mobil mengharapkan teman jgn mainan hp disaat isi bensin matikan mesin mobil menjaga keselamatan keamanan
1,hacker masuk facebook bbm kepolisian negara republik indonesia menghibau masyarakat indonesia waspada berhati hati perhatian pengguna facebook bbm metro tv mengeluarkan berita hacker masuk facebook bbm
1,muncul isu wali kota depok diperiksa terkait dugaan ijazah palsu kepolisian bantahan direktur resers krimin polda metro jaya komb suyudi ario seto agenda ya
1,kayu gelondongan impor china berisikan amunisi kayu gelondongan import china indonesia kekurangan kayu isinya amunisi ileg niat jahat
1,pedagang siram air pana fpi cek tangkapan layar
1,data resmi tni tunjukkan kemenangan prabowo pilpr alhamdulillah ya allah tni diragukan kesetiaannya rakyat
1,presiden mengajarkan politik presiden mengajarkan politik rakyatnya nilailah
1,tv dirusak pemberitaan harga bbm turun rupiah x bbm malam diem bbm turun x rupiah liput media koar vanqciattt
1,said aqil siroj dikabarkan sakit berita duka zait qkil zirod mati lg setengan mati kabar perud nya membengkak kaki nya gk bs bergrak sllu brterian histri kabar mengalami kejang menit nya tdk hnya kabar kn serang bisul mmbabi buta prut bokong nya masal
1,pesan berantai penculikan bocah terekam kamera pengawa anak hilang ditingg belanja diculik ayah
1,pemelintiran kontek video prabowo subianto produk ase prabowo produk ase
1,pendidikan agama dihapu pendidikan agama sekolah pelajar sekolah tingkah lakunya melampaui bata tiadakan anak anak
1,hati hati mengonsumsi ayam hai mom hati hati mengonsumsi ayam ya
0,wali kota semarang bantah kelurahan masuk zona merah difteri daerahnya tersebar kabar whatsapp media sosial kelurahan genuksari semarang masuk zona merah difteri
1,pemanggilan interview pt hokinda citralestari sehubungan rekruitmen calon karyawan perusahaan pt hokinda citralestari wilayah kerja meliputi region jawa region sumatra region kalimantan indonesia timur ang laksanakan depart of human resourc develop pt hokinda citralestari bertujuan menentukan individu berkualita sesuai tuntutan tantangan posisi tawarkan mendukung keberhasilan keberlanjutan kegiatan operasi pt hokinda citralestari wilayah kerja indonesia
1,fadli zon sadar fadli zon sadar paspampr grup a tim advanc aslog paspampr jam disamp presiden jokowi kebutuhan kepentingan beliau seleksi yg bertemu beliau paspampr yg presiden jokowi kinerjanya kinerja dprri period runyam target kerja terpenuhi ahli nyinyir kinerja nol fadlizon jangangorengpaspampr janganmainapi
1,video jokowi uang dipelintir informasinya perhatikan kayak cace kepanasan yg lakuka jokowi relawan nya fb yg blokir memasukkan warga ase dr tiongkok uwang makanan pinggir jalan sake takut nya tumbang kkedu nya kayak gini yg dinamakan jantel man
1,video serbuan tenaga kerja china mendarat bandara haluoleo kendari dasar penipu tergila abad berhenti berbohong
1,pemkot depok terapkan kebijakan jalan berbayar rua jalan margonda erp pemkot depok opsi penerapan ganjil genap margonda pemerintah provinsi jawa barat pemprov jabar mewacanakan jalan margonda raya berbayar electron road price erp mengatasi kemacetan mudah diatasi jalan utama kota depok menurutnya ide penerapan skema jalan berbayar satunya opsi diambil pemkot depok mengurai kemacetan rua jalan margonda diterapkannya kebijakan erp pemkot depok berpikir menerapkan erp opsi kebijakan ditempuh pemkot menyiasati kemacetan menerapkan ganjil genap jalan margonda arah erp berpikir konvension rua jalannya pendek masuk kendaraan permukiman berpikir kajian margonda ganjil genap weekend solusi atasi kemacetan kota depok opsi foto aa artikel kumparan
1,informasi tarif tol jakarta surabaya beredar media sosial media pesan media dare penetapan tarif tol kewenangan menteri pekerjaan perumahan rakyat pupr jalan tol tahap konstruksi tarifnya ditetapkan
0,mursal meningg terbunuh memaparkan limbah minyak goreng sdr mursal report meningg terbunuh memaparkan limbah minyak goreng ditubuhnya tusukan pisau kematiannya tragi negeri berupaya kontribusi miliar orang upaya keamanan pangan kesehatan membayar hidupnya muda lakukan untuknya forward terima kasih
0,india dadanya hancur hp samsul mbleduk surat man injur in mobil phone blast dibuka tampil ditampilkan tangkapan layar tampil tangkapan layar bhavesh thummer suffer injuri to hi chest left eye and ear and wa taken to smimer hospit where hi condit is report to be out of danger
0,the end of the legend kopi liong the end of the legend berita duka orang bogor penggemar kopi liong kopi legendari tutup tutup umur bertahan kota bogor
0,metro tv tenang berdagang trotoar tanah abang portal islam id serang ani sandi berita hoax metro tv dipermalukan haji lulung metro tv tenang berdagang trotoar tanah abang http goo gl hsu pk
1,pernyataan kapolda riau negara tentara polisi pernyataan kapolda riau negara tentara polisi
0,jokowi revolusi mental gagal agama dipisahkan politik meme berisi foto aidit jokowi narasi aidit revolusi mental berhasil masyarakat dijauhkan agama jokowi revolusi mental gagal agama dipisahkan politik
1,ktp pelaku bom kampung melayu ktp pelaku bom kampung melayu
0,alfian tandjung menuduh nu kendal rayakan hut pki tanggal mei alfian tandjung menuduh nu kendal rayakan hut pki tanggal mei
1,akun twitter antasari azhar mak tambain mbak ma pemirsa komeng bener akun antasariii mak ngeceknya ntar tunggu klaripikasi skrinsyut choel skrinsyutnya asli beneran palsu belon diklaripikasi pepo okkkkee tenk komeng mbak ma pemirsaaa yessss selamat makar malam yeee
1,klaim si penjual roti bersedekah aksi damai sari roti roti grati dibayar cash dr allah maha kaya si penjual roti bersedeqah
1,jendral gatot nurmantyo memiliki akun media sosial media sosial facebook beredar akun mengatasnamakan jendral gatot nurmantyo
1,foto kemacetan brebe foto tampilan kondisi pintu tol dipenuhi kendaraan diklaim salah pintu tol indonesia
1,jokowi dikabarkan pindah warga negara singapura lengser lengser ngumpet ya
1,surat libur pembelajaran jarak idul fitri tanggal mei s d juni dki jakarta menindaklanjuti surat edaran kepala dina pendidikan provinsi dki jakarta nomor perpanjangan pembelajaran jarak pjj darurat covid perpanjangan pembatasan sosial berskala psbb diberitahukan sbb kegiatan pembelajaran jarak dilaksanakan jumat mei libur idul fitri tanggal mei s d juni
1,italia mengontrol viru selamat tinggal dunia in itli they couldn t control the viru so the peopl of itali is say goodby to the world outsid the majid of milan thi is realli heart breakingstand with italylet s pray help from allahi am cri we stand with itali let s pray help from allah
1,masuk kota sukabumi memiliki surat keterangan kepolisian domisili warga kota sukabumi sehubungan himbauan pemerintah daerah menerima tamu berkunjung sukabumi mencegah membatasi viru corono covid menyebar masuk wilayah sukabumi kota menghimbau warga sukabumi membantu memberitahukan berkunjung sukabumi memenuhi peraturan yg sasuai intruksi presiden qq kapolri no skep polri iii pengunjung tamu keluaraga kota dilengkapi surat keterangan kepolisian domisi pengumuman diperhatikan
1,wuhan cina viru corona rakyat berbondong mesjid indon rakyat dilarang mesjid wuhan cina viru corona rakyat berbondong mesjid indon rakyat dilarang mesjid
1,king of the king doni pedro memiliki reken khusu rp triliun bni saldo reken king of the king bni rp t wuow sbi gerah
1,pesan berantai waspada penculikan anak kenalin muka sekelompok pencuri anak yg berkeliaran bantu sebarkan yg tau
1,foto hasil buruan singa iran serigala as hasil buruan singa iran serigala as trump pesan peti mati
1,foto china membangun persenjataan milit natuna senjata mengerikan china membangun persenjataan milit natuna senjata mengerikan
1,foto musim dingin anak anak gaza palestina musim dingin gaza tanah dirampa zionist rakyat palestina jd pengungsi negeri tinggal tenda makanan terbata jaket selimut seadanya dinginnya anak meningg orang dewasa sakit doakan slalu utk arafiah palestin
1,stempel palu arit pt wanxiang kapolr stempel ditemukan dokumen intern perusahaan kantor pusat kantor induk hasil penyelidikan negara indonesia perusahaan stempel berlogo bintang logo palu arit khusu urusan dokumen intern perusahaan
1,rektor umi bantah peryantaan beredar medso mimbar beba jihad pernyataan pernyataan beredar medso mimbar beba wajib jihad whatsapp mengatasnamakan
1,info penerimaan karyawan pt angkasa pura sm info penerimaan karyawan pt angkasa pura thn lulusan d s s jurusan daftar onllin via link bit ly ptangkasapura
1,pesan pangdam ix udayana cek gula darah jarum berviru aid perhatian jgn cek darah yg grati abal hati modu waspadai guru kep sek emak tergiur degan gratisan cek gule darah
0,klarifikasi sosdrjohnsimpsonforindonesia cek tangkapan layar
0,klarifikasi rektor uin suska riau terkait surat pemecatan ustaz abdul somad dosen ustadz abdul somad dipecat pn pemerintah tindakan rakyat umat islam ustadz perintah
1,eramuslim berka formulir c pk bima dirampok cek referensi
1,pembuatan sim te februari info pembuatan sim kolektif kabar gembira teman teman memiliki surat izin mengemudi sim diadakan pembuatan sim kolektif foto te
1,prabowo ngaji prabowo ngaji buktinya
0,klarifikasi polri kpk terkait kabar kabareskrim bongkar reken gendut ketua kpk hoax banget
1,ketum partai demokrat sbi mundur koalisi indonesia adil makmur aya nama ketua partai demokrat mundur koalisi adil makmur
1,kemarau melanda dunia turun dajjal musim kemarau melanda wilayah tanah air badan meteorolog klimatolog geofisika bmkg badan nasion penanggulangan bencana bnpb puncak musim kemarau agustu septemb
0,bu calon jamaah haji indonesia mengalami kecelakaan terbakar wilayah asfan sopir wni bernama syafii meningg penumpangnya warga turki wni
0,tribun news menuliskan densu mengamankan barang bukti al quran menggeledah rumah driver ojol terduga terori medan fenboi isi depresi berat gini hoax disebar wag penangkapan terori medan barang buktinya al quran biar benci polisi hati gae poto hoax beritanya foto ketiga link aslinya http video tribunnew com driver ojol terori ditangkap
1,registrasi ulang nomor ponsel nama china hati registrasi ulang no hp nik kk nama china
1,kayu mani vs kenc mani mani kayu mani vs kenc mani baca kesaksian teman grati berterima kasih klinik kesaksiannya
1,serunya layar pemotretan presiden jokowi klender hai tolong pencerahannya sy hoax ya foto nya msh keliatan editan editannya emang bagu yg bs nambahin info sumber photo yg d comot dsb lbh mudah kl hoax
1,pt transjakarta buka info lowongan kerja minat kerja transjakarta busway buka lowongan kerja onboard cashier laki laki perempuan usia minim pendidikan minim sma sederajat badan cm m cm f berka fotokopi ktp surat keterangan domisili fotokopi ijazah fotokopi skck berlaku surat keterangan sehat rumah sakit pemerintah surat keterangan beba narkoba pa foto lembar
1,hti menang ptun hti menang ptun
1,sultan ibn khalid ibn sultan al saud bertemu polisi new york welcom to new york princ and meet our polic when saudi princ meet a new york cop
1,rekruitmen pt angkasapura airport buka lowongan pekerjaan pt angkasa pura airport
0,aplikasi whatsapp berpotensi disalahgunakan penyebaran berita palsu fitnah aplikasi whatsapp berpotensi disalahgunakan penyebaran berita palsu fitnah
1,suara adzan berkumandang masjid tutup inggri subhanallah video masjid resmi ditutup pemerintah inggri aktifita didalamnya terdengar masjid suara adzan masuk sholat subhan sungguh keajaiban wartawan meliput mengabadikan kejadian kejadian london masjid diperintahkan pemerintah aktivitasnya hentikan masjid tutup suppli listrik jaga ketat kuasa allah sholat berkumandang adzan didalam masjid kosong sang muadzin adzan allah kebesaran nya allahu akbar from ifa zaiyana semoga menambah iman taqwa
1,covid murni sebabkan kematian dr stoian alexov ahli patholog eropa menyebut who organisasi medi krimin menciptakan ketakutan chao dunia bukti wabah diverifikasi obyektif kritikan data korban valid murni penyakit menyertai komplikasi
1,video covid covid
1,sepi pemberitaan media today revolusi berjuang menumbangkan rezim jokowi sepi pemberitaan media today revolusi semoga alloh swt merestui melindungi patriot bangsa terpanggil hati nuraninya berjuang menumbangkan rezim jokowi lupa doanya pemirsa semoga alloh swt orang berak sehat rezim secepatnya wassallam the end
1,video italia bergema takbir aamiin sdh terjdi wabah yg kkuasaan allah sbelum nya mreka terlena dgn knikmatan dunia dgn gaya hidup rupa nya takut jg kmatian smg mnjadi pelajaran bg yg berak
1,cuitan giliran tweet sadpost sepi giliran tweet sadpost sepi emang jiwa parti ya warga indonesia
1,rakyat italia buang duit jalan berguna akibat viru covid italia rakyat buang duit kejalan disebabkan harta berguna viru covid nineteen menular
1,obat dibe jokowi cina komuni berbahaya berakibat kematian obat dibe jokowi cina komuni berbahaya berakibat kematian suruh jokowi aja yg minum obat akibat tenggak obat chloroquin warga as semaput langsung masuk kamar mayat mati
1,informasi pembuatan sim kolektif te maret info pembuatan sim kolektif kabar gembira teman teman memiliki surat izin mengemudi sim diadakan pembuatan sim kolektif foto te
1,surat pengumuman lelang jabatan kementerian agama pengumuman seleksi terbuka calon pejabat pimpinan kementerian agama
1,namanya aksi terori biadab kejadian wamena mengerikan namanya aksi terori biadab kejadian wamena bagusnya aja diangkat biar rezim sadar udah lakukannya melindungi rakyatnya innalilahi wa innalilahi rojiun semoga meningg husnul khatimah
1,universita indonesia terkait kelompok ikatan keluarga universita indonesia kantor huma kip ui universita indonesia memiliki kaitan apapun kelompok pernyataan sikap kelompok mewakili sikap universita indonesia
1,kisah nyata arif anak berusia narapidana cerda membunuh preman kabur lapa kali mengharukan namanya arif statu narapidana cilik terang kali mengadakan penelitian krimin lp pengalaman kali pengalaman ngobrol langsung didakwa pembunuhan berencana
1,anggota bawaslu kpu plonga plongo prof ronni higuchi rusli pakar it statistik guru ui dipanggil bawaslu sbg ahli kesahihan qc lembaga survey surveyor qc yg hadir menariknya prof ronni anggota bawaslu kpu plonga plongo rumu yg disajikan beliau yg kpd prof ronni
1,video obama merili lukisan prabowo sosok pemimpin akui dunia mr prabowo subianto simpulkan aprilprabowopresid
1,bupati nduga diculik tni bupati nduga culik tni
1,surat pernyataan orang lolo seleksi pt pertamina no hrd pt pertamina persero iii lampiran rangkap panggilan seleksi rekruitmen karyawan i
1,tv mnc grup adzan maghrib diganti iklan menang sdh menghilangkan adzan kalo sdh menang menghilangkan islam buang chanel mmc tv nyandu chanel mayorita muslim buta politik ummat islam bersatu ngikut ulama menyar chanel tv tunduk atur berhubung ummat bersatu mengatur tontonan semau tinggalkah anak cucu ngikut pola fikir manusia tergantung lihat dengar
1,pidato kebangsaan hasil survei prabowo sandi s malam paparan pidato kebangsaan prabowosandi hasil survei nya allahu akbar
1,ijazah sma presiden joko widodo palsu ijazah sma negeri surakarta nama joko widodo terbukti palsu mengaku lulu sma sma n surakarta berdiri kpu ritidak verifikasi by ireneviena chirpstori link http chirpstori com li chirpstori com li chirpstori
1,kuat mu terinjak injak anj anj komuni kuat mu terinjak injak anj anj komuni sanggup menyaksikanmu terbantai ampun
0,kepolisian kalsel amankan penyebar hoak pembunuhan levi prisilia wakapolda kalsel brigjen aneka pristafuddin amankan pemuda berinisi mr dimana bersangkutan amankan terkait berita menghubungkan kejadian berbeda kaitannya
0,mengen likuifaksi fenomena tanah bergerak gempa palu gempa palu mengerikan rumah pohon berpindah terdorong pondasi akarnya
0,pejemputan paksa ulama bireuen polisi langsung panggil belah perangkat desa tokoh budaya tokoh agama alhamdulillah klir jemput paksa kapolsek kota juang akp ahmad arief sanjaya selasa
