label,fitur
1,jokowi nama lahirnya herberthu jokowi nama lahir nya herberthu ber agama kristen jelang daftar jabatan walikota nama nya ganti jokowidodo ayahnya bernama oey hong liong alia widjiatno non muslim aktivi pemuda rakyat pki kenal kejam sadi tgl oktob membantai puluhan jiwa kaum nahdiyin tewa kampung giri roto ngemplak boyolali jateng
1,year end fun walk lippo karawaci terkait aksi tandingan udah rakyat tni polri satpam pn orma parpol plat merah karyawan keluarganya perusahaan rumah sakit dipaksa repot diwajibkan penguasa ngikut aksi
1,wn china jakarta bela ahok pesan berantai wn china jakarta bandara soekarno hatta membela gubernur dki basuki tjahaja purnama ahok
0,klaim jonru dunia peduli umat muslim korban bom turki umat islam terbunuh dibicarakan
1,rayhaneh jabbari dihukum gantung pemerintah iran raihanah jabbari muslimah sunni dihukum mati pengadilan syiah iran membunuh laki merusak kehormatannya pengadilan hakim engkau membunuh laki
1,data pertumbuhan ekonomi aceh pertumbuhan ekonomi kota aceh period kota sabang no tertinggi laju pertumbuhan ekonomi pimpinan nasu
1,tangkapan layar berita rk ajak abu janda relawan uji vaksin covid buatan china rk ajak abu janda relawan uji vaksin covid buatan china
1,fpa dukung jokowi syarat laskar diangkat pn berbalik dukung jokowi korlap fpa ya dukung jokowi syarat laskar fpa diangkat psn
1,dirut rsui direktur rsui staff rsui dirawat rsui terkena covid rekan jkt mohon berhati ya jkt penularan covid meningkat dirut rsui direktur rsui staff rsui dirawat rsui terkena covid perawat rs swasta jkt terjangkit covid semoga kesembuhan waspada
1,anoth simpson predict that becam a realiti theyknew anoth simpson predict that becam a realiti theyknew
1,pembatasan sosial jakarta bandung diterapkan lockdown masker linta tol bandung jakarta jakarta bandung
1,daftar viru beras china more left wing facebook censorship as famous said a pictur say it all
1,video azan spanyol dilarang azan dilarang spanyol andalusia kemarin maret azan daerah kali kumandangkan krisi corona global apapun yg haruslh berbaik sangka kpd allah masyaallah semogah wabah corona cpt allahuakbar allahuakbar allahuakbar
1,video jemaah umrah tertahan pesawat positif terinfeksi viru corona jamaah umroh palembang makassar nangi jamaah indonesia nyatakan positif terinfeksi viru corona pesawat diijinkan masuk saudi dibawa pulang indonesia
1,erick thohir nyamar tukang bakso bongkar skandal ari garuda erick thohir nyamar tukang bakso bongkar skandal ari garuda teknik penyamaran tukang bakso ciri kha intel indonesia ord
1,ani gelar kehormatan perkumpulan tiong hoa dg nama liem ay bon ani gelar kehormatan perkumpulan tiong hoa dg nama liem ay bon
1,kecelakaan beruntun tol pemalang akibat searah arah mimpi buruk kecelakaan mengerikan jalan tol pemalang searah arah resikonya hati dlm mengemudikan mobil tol diubah arah admindedi
1,korban kecelakaan pesawat ethiopian airlin boe max the last moment of the ethiopian plane crash victim god have merci
1,postingan facebook tutut soeharto menyindir jokowi pembangunan jalan tol dik joko widodo kuliah aja sy bangun tol hutama karya jd klo nerusin tol yg penambahan bpk pembangunan dik jokowi krna pembnguann melekat dihati rakyat almarhum hm soeharto bkn yg ayo bersatu kmbali dukung no prabowo sandi
0,sikat gigi berbahan bulu babi hati hati memilih sikat gigi tau
0,bantah nomor urut untungkan jokowi maruf komput sistem biner kpu tegaskan perhitungan suara manual berpengaruh penambahan angka penghitungan suara komision kpu hasyim asyari rabu
1,rumah sakit jiwa kampret merawat pendukung prabowo stre gila kalah pilpr
1,air miner meledak kepanasan mobil menyimpan air minum mobil mengatasi hau bepergian mom kebiasaan menyimpan botol berisi air mobil disarankan siang terik suhu musim pana kebiasaan memicu ledakan pana matahari bersinar jendela botol air air botol bertindak lensa sinar matahari mengenainya botol permukaan gelap memicu api video facebook idaho power teknisi stasiun baterai dioni amuchastegui mencobanya menghindari kejadian hindari ya kebiasaan musim hujan menutup kebiasaan menyebabkan kebakaran kadangkala cuaca pana paparan sinar matahari terik
0,wacana pendaftaran akun medso e ktp mendukung jokowi akun medso menyertakan ktp kartu keluarga npwp jamsostek tanda tangan juragan partai dukung jokowi pdip saham medso
1,keajaiban amerika kanada matahari keajaiban amerika kanada matahari yg hunter moon perubahan orbit matahari terbenam terbit bersamaan berhadapan sudut derajat memantulkan cahaya matahari terangnya matahari
1,pemerintah memantau jalur komunikasi media sosial masyarakat beredar info wa group besok peraturan komunikasi panggilan dicatat rekaman panggilan telepon tersimpan whatsapp dipantau twitter dipantau facebook dipantau media sosial forum dimonitor informasikan
1,run text metro tv istighosah tanggal februari dirumah djan faridz dihadiri kiai said aqil siroj run text metro tv istighosah tanggal februari dirumah djan faridz dihadiri kiai said aqil siroj
0,indochina penyebutan negara indonesia china postingan foto kontain tulisan indocina narasi provokatif narasinya negara indocina presidennya
1,antasari azhar memiliki akun twitter beredar kabar akun twitter nama antasari azhar mantan ketua kpk mengomentari basuki tjahaja purnama ahok
1,presiden mengundang pelaku pembakaran masjid tolikara thi will never be forgotten
1,pidato lengkap jokowi negara berhutang pinjaman negeri haiyyaaa plecid hoo plecid hutang lho pinjam pinjam lual nege
1,nyanyian yg kenyataan menyedihkan nyanyian yg kenyataan menyedihkan
1,jokowi jarang busana jawa kuno gak pede jokowi jarg mngenakan busana jawa krn busana jawa kuno gak pd
1,satpol pp pakai sepeda brompton harga seratu juta hasil foya foya uang rakyat satpol pp pakai sepeda dg harga seratu juta buatan inggri kadang emg ngena lihat pejbt publik suka bgt memfoya uang rakyat satpol pp daerah ya
1,pemuda pemudi mengatasnamakan universita perguruan foto ktp pemuda pemudi mengata namakan universita perguruan ktp alasan bahan skripsi orang memfoto ktp diijinkan foto ktp peminjaman onlin
1,bupati luwu utara terbar rs terjatuh motornya banso covid mohon do a salam iluni ui bupati luwu utara terbar rs beliau terjatuh motornya banso pelosok semoga pulih ya bu aamiin yaaa allah
1,video italian millionair terjun bagunan keluarga nya kena viru corona uang italian millionair terjun bagunan keluarga nya kena viru corona sdh mati d a sad
1,kim jong un mengenakan kemeja putih bertuliskan bersih merakyat kerja nyata ndro kayak nya butuh kim jong un mengatur tka yg susah diatur
1,they call it disinfect they call it disinfect indonesia no word
1,china bangun rumah sakit lantai ruaaaarrrr biasaaa china bangun rumah sakit lantai khusu pasien viru corona jam menyelesaikan lantai selesai lantai listrik air peralatan rumah sakit viru corona
1,surat berisi cuti libur natal tanggal desemb edaran cuti raya natal jatuh tanggal desemb
1,video habib rizieq shihab bandara juanda habib rizieq shihab bandara juanda
1,subjudul cover majalah tempo ahok dijadikan bo pertamina menguasai blok masela pengusaha tomi winata mendadak masuk pembangunan blok masela menggelembungkan biaya proyek lng terbesar indonesia
1,viru babi hog cholera menular manusia areal medan stop beli dage babi dimasak dimakan dijual berbahaya wabah viru mematikan manusia cuplikan isi percakapan wa
1,pt waskita karya bantah adakan interview rekruitmen karyawan halo surat panggilan hoax alia penipuan ya berhati hati menerima informasi
1,pesan singkat arahan kapolri tni tunduk hukum kepolisian upppssss aduhh begiman pakpol bocor arahan kapolri arahan kabagintel polri bocor asop polri bocor bocor waya waya waya
1,susunan kabinet kerja jilid ii jokowi maruf susunan kabinet indonesia kerja period presiden ri ir h joko widodo wakil presiden ri prof dr hc kh ma ruf amin
1,video polisi sembako jelang pilpr didepan pasar gede solo silahkan nilai udah mala mention polisi kpu bawaslu pekerjaan sia koar koar sok suci jijiklah
1,kuaci direbu tulang babi cnp sila viral pd ummah kuaci ni famou sy dok mkn time reja director sy cina mualaf tegoq bahasa cina kt bungkusan tu kuaci ni direbu tulang babi
1,jokowi bilang pki bersalah mengancam presiden joko widodo menilai komunism komuni salah sejarah aslinya korban radikalism faham gari kera ancaman terbesar dasar negara
1,dihapusnya kementerian agama diganti namanya rumusan bentuk terapkan paksa jokowi period dihapusnya kementerian agama diganti namanya kementerian urusan haji zakat wakaf
1,y k komput membedakan nyata data tercatat ilmuwan menemukan permasalahan y k kiamat komput diprediksi januari utc angka maksimum dicatat sistem bit
1,parah pesawat kepresidenan dijual pesawat kepresidenan dijual penjualan pesawat efisiensi anggaran
1,kahmi menyelenggarakan deklarasi dukungan ani baswedan capr undangan deklarasi dukungan kahmi calon presiden ani
0,sekber orma okp capr cawapr jokowi tito beredar sekber orma okp persiapan capr cawapr presiden joko widodo kapolri jender pol prof h muhammad karnavian ph d kawan tito hoax be smart netizen yaa mitra huma
1,kadisdik sumsel mengklarifikasi selebaran aksi kelulusan pelajar hoak debunk berisi klarifikasi kadisdik sumsel terkait selebaran aksi kelulusan pelajar beredar media sosial dina pendidikan sumsel langsung mengeluarkan ultimatum kegiatan terlaksana siswa peringatan sekolah mewadahi kegiatan diarahkan kegiatan positif edukatif
0,kunjungan jokowi nz disambut aksi papua merdeka viral video jokowi dipermalukan selandia intelijen kecolongan
1,presiden korea utara agama islam masuk korea utara presiden korea utara agama islam yg masuk korea utara menirama islam berdiri korea utara mendukung korea utara kedepnya mnjdi negara yg mayorita muslim slain islam izinkan agama masuk korea utara
0,pki ketangkep basah pki ketangkep basah break news acara pki klender jakarta timur bubarkan tni fpi fbr bang japar
0,kapolda anton charliyan pencitraan berpakaian islami kapolda anton charliyan pencitraan berpakaian islami
0,kebakaran mengurung israel pelarangan adzan palestina kebakaran mengurung israel penjuru titik mendekati pangkalan milit israel kebakaran berselang pelarangan adzan wilayah palestina israel mengemi bantuan turki yunani cypru allahu akbar
1,dai arifin ilham unggah postingan foto ribuan umat muslim rohingya dibakar hidup hidup ribuan umat muslim rohingya dibakar hidup hidup
1,pembuat desain roti al maidah berani berbuat berani tanggung kabur sembunyi
0,walikota solo larang buber halal bihal sekretari daerah sekda solo mengeluarkan surat edaran larangan buka bukber halalbihal mengatasnamakan satuan kerja perangkat daerah skpd
1,syiah menyerang saudi musim haji dapet berita koran edisi pnri penyerbuan kaum syiah musim haji novemb masjidil haram menyandera imam solat subuh senjata ak dilipat
1,aplikasi i doser narkoba digit share dr hasil seminar kemarin hf dursaw darurat narkoba tipe digit narcot yg sgt mudah aks dr smart phone namanya aplikasinya i doser ortu doakan spi anak terhindar dr pengaruh buruk
1,pernyataan jokowi ekonomi indonesia terjun beba utang anjai ancor ancorrrrrr ayooooo bikin jokowi pertumbuhan ekonomi indonesia terjun beba ngutang gaess
1,narasi poster ahi ketua partai demokrat period lupa pilkada dki agusyudhoyono dipaksa pilgub sbyudhoyono ahi aktif tni berpangkat mayor dipaksa mundur gegara ikutkan pilgub gagal
1,who mention vegetarian not affect covid who mention vegetarian not affect covid
1,video lockdown spanyol lockdown spanyol india beruntung dipukul tongkat
1,obama mencalonkan presiden kenya artikel worlddailynewsreport com berjudul barack obama announc intent to run as presid of kenya in berisikan informasi barack obama mengonfirmasi keinginannya maju pilpr kenya artikel obama percaya mengatasi permasalahan kenya lakukan menjabat presiden amerika serikat
1,singapor is like a communist china who hate islam the singapor infidel polic held a terrorist countermeasur exercis in the mosqu while still wear unclean shoe on the mosqu carpet laknatullah alaihim sinc it wa rule by china singapor is like a communist china who hate islam
1,parutan kelapa sebabkan kremian paham teori generatio spontanea runtuh alam sadar percaya cace kermi permukaan dubur wujud penjelmaan kelapa parutan alia urap dimakan
1,istri sah labrak wanita simpanan dirut garuda ci gundik kena sial nya labrak sm bini sah ny ci raja lendir salah hotel mewah d jakarta miara gundik ci raja lendir extra ngorupsi ny membahagia kn sang gundik dr opla mempercantik d salon d negri belanja ta ta brand jalan jalan k negri dsb
1,ditjen bea cukai angkat bicara terkait munculnya informasi tawaran hadiah pulsa masyarakat info jasa titip barang bermerek kasubdit komunikasi publikasi ditjen bea cukai deni surjantoro hoak pulsa
1,pertolongan stroke tusukan jarum ujung jari daun telinga pertolongan stroke orang yg kena stroke mendadak jatuh dr wc dsb pembuluh darah otak pecah mengatasi gugup panik korban kejadian dikamar mandi ruang tidur ruang tamu dll
1,polisi bantah viralnya penampakan pocong wilayah tangerang menanggapi kapolsek sepatan akp i gusti sugiarto penampakan pocong viral kawasan sepatan teluknaga pakuhaji hoax
0,kementerian pupr penjelasan isu rumah subsidi habi dituliskan bantuan perumahan subsidi habi lihat flpp capaian kinerjanya persen persen prose dipros disetujui ssb kinerjanya persen berharap agustu capaian tercapai
1,pln malu etika pln bumn perusahaan milik negara mencari pendapatan negara pegawainya mendukung menjalankan pekerjaan program pemerintah mendukung capr petahana
1,tangkapan layar artikel web kpu direta temuan mengejutan jokowi angkat isu pki ramai ramai websit kpu direta akun oposisi opposit bener ga ya yg bersangkutan sih udah bilang ga bisalah percaya gitu aja kubu
1,petik buah rambutan grati kandang harimau kebun binatang surabaya kebun binatang surabaya petik buah rambutan grati ti buka dr jam kereen yo suroboyooo r k
1,pemberitahuan pemenang undian bank bri info resmi nasabah bri terbaik dgn kode pin memenangkan cek rp jt
1,foto pelajar smp pegang spanduk berisi kritikan jokowi kerjanya utang jual aset foto diedit isi tulisannya menyinggung utang jual aset impor bera isi tulisan sesungguhnya spanduk doakan cita cita hafal juz alqur an
0,suara sumbang petani kendal digusur proyek tol memuluskan ambisi proyek infrastruktur tol nya jokowi rela meninda mendzolimi raktaynya kelakuan berharap suara rakyat period ngimpi gantipresiden
1,kadi pendidikan kota bengkulu klarifikasi terkait ujian bermuatan sex beba debunk berisi klarifikasi kepala dina pendidikan kota bengkulu rosmayetti terkait pjok tingkat smp mt dimana ujian tepatnya nomor pilihan ganda perih sex beba
1,china menghancurkan dunia china menghancurkan dunia kerjasama tiongkok dgn uni emirat arab dlm pembuatan rel kereta api cepat dimanfaatkan utk mengekspor jutaan butir ekstasi yg diisikan bbrp spare part utk konstruksi kereta api cepat tsb persi dg mengirimkan tiang pancang indonesia berisikan pil setan tsb negara on waspadalah kerjasama negeri komuni tsb lihat video dibawah tercengang dg usaha gigih yg rapi
1,gambar rili divisi huma polri kelengkapan sepeda motor disunt gambar hasil suntingan gambar asli dimuat http bit ly qpowjx
1,guy tolong beli cokelat snicker guy pleas dont buy snicker chocol bar guy tolong beli cokelat snicker negara membuang membakar ratusan snicker terkontaminasi membahayakan kesehatan memakan cokelat orang tua awasi makanan anak anak makanan sehat bekal aman tolong bagikan
1,jogja tionghoa metro tipu penjajah jogja tionghoa metro tipu penjajah fahami sejarahnya luruskan logika save logika save indonesia
1,hujan batu pana erupsi gunung agung menimpa desa dukuh bali menteri koordin bidang kemaritiman luhut binsar panjaitan gunung agung berstatu awa batu batuan gunung mdpl lemparan batu batuan
0,share share
0,dituduh menistakan agama walikota risma dilaporkan polisi dituduh menistakan agama walikota risma dilaporkan polisi
1,kisruh liga drama laga mitra kukar melawan bhayangkara fc lanjutan kompetisi gojek traveloka akibat kebohongan mitra kukar mengerti sepenuhnya mitra kukar yg kesalahan sanksinya menguntungkan bayangkara fc laga mitra kukar vs bayangkara tetaplah laga imbang real skor mitra kukar memainkan pemain yg bermain ya sanksinya berimba mitra kukar prihatin bali unit pecintanya peluang juara yg mata menguap bu susi tolong tenggelamkan pssi penyakitnya sembuh sembuh
1,indonesia dibodohkan air miner penelitian harvard univers menambah temuan betapa bahayanya air miner mengandung flourida air miner aqua kepunyaan danon aqua sahamnya dibe danon mengandung zat flourida
1,banser mengangkat salib banser semoga hidayah nasi bungku rela mengangkat salib menjaga gereja dibapti menggadaikan aqidah lapaaarr
0,aksi demo membela sahabat driver terancam penjara izin share lur aksi demo membela sahabat driver yg terancam penjara
1,penyalahgunakan nama cnn indonesia telegram chat penyalahgunakan nama cnn indonesia telegram chat
0,polemik ip address server baladacintarizieq com polemik ip address server baladacintarizieq com
1,my roti klone sari roti my roti kloningnya sari roti uhuuyyyi berubah penampilan ni yeeee
0,dihadang warga penjaringan ahok kabur kebun gubernur dki jakarta basuki tjahaja purnama ahok berhasil meloloskan hadangan ratusan warga penjaringan jakarta utara menunggu kehadirannya wib
1,drone mata mata berbentuk serangga didanai pemerintah amerika serikat produksi it s an insect spi drone for urban area alreadi in product fund by the us govern it can be remot control and is equip with a camera and a microphon it can land on you and it may have the potenti to take a dna sampl or leav rfid track nanotechnolog on your skin it can fli through an open window or it can attach to your cloth until you take it in your home
1,firza kunci habib rizieq menyangk pembicarannya menuduh yusril kebohongan dilakukannya berpos ketemu peluru kendali benua bernama firza
1,matahari lunar hunter matahari muncul perbatasan amerika serikat kanada matahari asli fenomena lunar hunter bumi mengubah porosnya matahari lahir bersamaan memantulkan sinar matahari intensita kuat matahari bagikan cantik
1,buntut penerapan psbb palembang bata operasion aks besok selasa mei palembang psbb bata operasion jalan jam wib jam jalan ditutup aktivita berjalan kaki berkendaraan berkantor berjualan dihentikan pelanggaran dikenakan sanksi beritahu sanak saudara teman
1,video amerika penjarahan ketakutan viru corona amerika penjarahan indonesia
1,video angin pute beliung menerjang sukabumi innaa lilllaahi angin pute beliung menerjang sukabumi semoga korban jiwa
1,in an era of coronaviru in china money is no longer the best thing in the world in an era of coronaviru in china money is no longer the best thing in the world
1,spanduk larangan bersholawat udah terang an larangan bersholawat
1,jokowi fake and authoritari presid of rrc communist indonesia branch jokowi fake and authoritari presid of rrc communist indonesia branch intern
1,melawan diancam prose hukum berjalan strategi tempatkan org bermasalah diposisi strategist utk kecurangan melawan diancam prose hukum berjalan
1,profesor gabe bin abdulah beras amerika latin kagum pendukung prabowo profesor gabe bin abdulah beras amerika latin kagum pendukung prabowo karnakan menyerah melawan kecurangan beliau beliau membantuk paslon dana juta us dollar untung kepentingan paslon sidang mk kecurangan paslon mari sebarkan tagar gabebinabdulah sebarkan post biar paslon tau orang paslon orang yg jujur hormati orang
0,unggahan hasil c pleno tp bangil pasuruan berbeda hasil situng kpu hasil c pleno tp berbeda hasil scsn c situng kpu
1,foto ra kartini berjilbab berkaca mata photo asli ra kartini santri kyai saleh darat memakai kond berkebaya foto ra kartini berkond berkebaya versi belanda dikeluarkan kaum sekul ra kartini dikenang perempuan berjilbab
1,pria misteri berkumi pria misteri berkumi
1,pencairan tunjangan raya pensiunan pegawai negeri sipil tanggal juni berdasarkan notulen rapat direktorat pembendaharaan kementrian keuangan republik indonesia tanggal mei pembayaran thr pensiunan pt asabri persero pt taspen persero
0,polri bongkar grup the famili mca sindikat penyebar isu provokatif polri bongkar grup the famili mca sindikat penyebar isu provokatif
1,produk produk bumbu penyedap masakan mengandung babi produk produk bumbu penyedap masakan mengandung babi
0,nama meikarta diambil tragedi mei jakarta nama meikarta diambil tragedi mei jakarta
1,pakar it no dubai chat habieb rizieq shihab firza palsu pakar it no dubai chat hr firza palsu fake penjelasannya
1,jadwal seleksi penetapan sk cpn selebaran narasi jadwal seleksi penetapan sk cpn dirili
1,larangan sholat istana pegawai dilingkungan istana resah sholat masjid baiturahman diperbolehkan kecuali sholat jumat
1,foto foto korban rohingya biadab dunia diam seribu bahasa islam yg korban seakan pembantaian muslim keniscayaan
1,merugikan dage beku persi tinggal australia dagingbeku diexpor gada yg australia melegalkan penggunaan hormon pemacu pertumbuhan ternak yg dilarang eropa diduga memicu kanker jokowidagingbeku
1,tertangkap pelaku pembunuhan modu operandi gantung babinsa apresiasi keberhasilan pengungkapan tindak pidana pembunuhan terencana kalo tni polri gabung lubang semutpun bersembunyi gali hukuman pembunuhan berencana penjaga keamanan negara rakyat indonesia alhmdulillah tertangkap pelaku pembunuhan dgn modu operandi gantung serda rusdi babinsa koramil kabaena kodim buton provinsi sulawesi tenggara tertangkap gabungan tni polri pelaku pembunuhan orang penyebab pembunuhan serda rusdi didalami hipakad povinsi kalimantan berduka cita semoga arwah beliau lapangkan
1,pohon natal lambang sumatera barat pohon natal logo sumbar sumatera barat provinsi religiu dimana jokowi suara disana kursi dprd dikuasai gerindra pk pan partai tuhan mbah amin sodara lambang daerah sumbar simbol pohon natal pohon korma ya pohon pisang pohon cemara ustadz balonku takbir rapatkan barisan tegakkan kebenaran salam baper
1,lagu corona dr bimbo lagu kenyataan lagu corona dr bimbo dianggap sbg lagu skrg terbukti lagu th yl kenyataan subhanallah
1,warga dihimbau melinta toko spectra odp akibat viru corona utk jngan toko spectra pangarangan cina toko spectra yg jual elektronik udah odp corona habi date dr singapura berobat dtetapkan odp dink sumenep utk menghindari kejadian bs terjangkitnya penyakit corona mend jngn info a dr kalebun pangarangan
1,rs premier bintaro lockdown tenaga medi positif covid si and broo avoid rs premier bintaro dlu ya lg kena lockdown tenaga medi positif terkena covid
0,who t j coronaviru coronaviru keluarga viru menyebabkan penyakit hewan manusia manusia coronaviru menyebabkan infeksi pernafasan flu penyakit parah middl east respiratori syndrom mer sever acut respiratori syndrom sar viru corona ditemukan menyebabkan penyakit coronaviru covid
1,ledakan dahsyat kota wuhan disembunyikan pemerintah china a power explos occur in wuhan the chines govern is hide thi inform coronaviru ledakan dahsyat wuhan pemerintah cina menyembunyikan informasi koronaviru
1,video buaya dusun lopang driyorejo gresik dusun lopang driyorejo gresik
1,uym sindir ua menceraikan istri halnya kedzaliman ustadz yusuf mansur angkat bicara beliau perceraian islam
1,foto artikel madinah dilanda gempa tanda dajjal persembunyiannya madinah dilanda gempa dajjal persembunyiannya gempa berkekuatan skala richter menyerang sebelah barat madinah kemarin januari getaran gempa lemah menimbulkan kehancuran dilaporkan khaleej time
1,auman raksasa dajjal dasar lautan samudra pasifik dpt info sorri kalo telat ngabarinnya iran pkl ba da magrib mndapati gempa gerhana bnyi ganjil lgi sprti ngauman raksasa yg kdua kalinya dri bwah dasar lautan samudra pasifik mnurut ulama suara dajjal yg brusaha kedunia sbab senantiasa tdk brhenti adzan shalat yg membaca tlong sbarkan orng jngan dipermainkan
1,jin parkiran gedung dpr hadir agenda pelantikan jokowi maruf udzu billahi mina syaithonir rojiim parkiran gedung dpr jin hadir agenda pelantikan saudara jokowi ma ruf bersyukurlah bangsa jin pd allah krn hikmah yg allah sembunyikan bangsa jin pandangan mata bangsa manusia
1,foto viral lutfi alfiandi cover majalah internasion lutfi alfiandi fotomu mengguncang dunia gedung pbb indonesia ruang remaja aspirasi menghimbau menahan pendemo jam
1,bandara termin sukarno hata terpasang kilat cina air line selamat cina indonesia bandara termin sukarno hata sdh terpasang kilat cina air line selamat cina indonesia
1,lahan tni al surabaya dieksekusi pengadilan pengembang cina separah kah potret negeriku lahan tni al surabaya dieksekusi pengadilan pengembang cina waduuhh betapa konyolnya negara
1,wanita aceh utara korban kejahatan dibuang mobil souna kehilangan aneuk dara bajo kejadian sp dama jitiek lam moto jino kajiba u puskesma lhoksukon aceh
1,ribuan warga baduy bergerak ibukota ire ngan suku badui berangkat kejakarta ala kaki yg bela hidup mandiri bantuan pemerintah biarpun tolak
1,dimatiin nutupin fakta husni kamil manik aja dimatiin nutupin fakta sekela petuga kpp nyawanya murah meriah demokrasi genosida
1,jokowi hapu pendidikan agama islam terpilih presiden memilih prabowo pikirkan nasib agama anak anak kitanya menikmati pelajaran agama sekolah dihapuskan jokowi menteri menterinya
1,anggota panwaslu kpu buka belang lembaganya anggota panwaslu kpu buka belang lembaganya forum rapat
1,sore awan berdoa sore awan berdoa semoga yg membagikan kuasa allah besok pagi rezekinya berlimpah aamiin
0,pertamina bantah mengurangi kuota bbm bersubsidi wilayah solo raya yogyakarta isu kelangkaan bahan bakar minyak bbm bersubsidi jeni solar wilayah solo raya daerah istimewa yogyakarta pt pertamina klarifikasi
1,makar disampaiken kemarin wirr dimana wiranto
1,rumah sakit jiwa kecebong rumah sakit jiwa kecebong
