label,fitur
1,smpn jakarta klarifikasi isu gurunya pasang foto presiden wakil presiden menghormati guru guru pandai mengen cakrawala dunia guru
1,sam lokon anggota knpb penggunaan ular interogasi orang papua ditangkap marak sam lokon anggota knpb video kabarnya wamena
1,jokowi orang terkaya nomor asia daftar orang terkaya asia jokowi milyad usd no melampaui kekayaan eka cipta wijaya
1,china menghancurkan dunia disinformasi kali diedarkan pil beras china turki
1,percobaan pembunuhan habib alwi abdurahman assegaf barusan dpt info percobaan pembunuhan habib alwi abdurahman assegaf mohon infonya komuni beraksi ranupsprosandi prabowopresiden
1,cut pat kai lahir bayi babi hutan wujud manusia dinamakan cut pat kai
1,viral pendaki meningg gunung bawakaraeng ketemu orang min udah meningg kemarin kriti dapati jarinya biru temannya orang cuman menghay kasihan ditingg leadernya ngotot puncak badai po
0,klarifikasi dina bina marga dki jakarta terkait anggaran rp miliar bangun jpo kepala dina bina marga dki jakarta yusmada faizal anggaran rp miliar pembangunan jpo jalan jender sudirman mh thamrin angka final angka asumsi pembangunan jpo angka rp miliar bangun membentang meter lebar meter jpo yusmada
1,polisi merazia spanduk bertuliskan ganti presiden sumatera utara hoak sweep sweep setyo menghadiri diskusi bilangan mampang prapatan jakarta selatan selasa
0,hoax crisi centr will be launch to counter falsehood ahead of indonesian elect say founder of anti hoax network pusat krisi hoax diluncurkan mengatasi kebohongan menjelang pemilihan indonesia pendiri jaringan anti tipuan
0,ustadz aceh tenggara diserang pria salat zuhur asatgfirullah diserang orang gila didesa amaliah kecamatan bukit tusam kabupaten aceh tenggar hoak mengalaminya hati sahabat dakwahku allahu akbar
1,share emoticon baterai grup mengisi penuh baterai hp ni magic seriu dicipta nur syazwina syukrina zurina pelajar univers coba kirim grup batteri penuh
1,lowongan magang panti sosial bina remaja taruna jaya dibuka lowongan pekerja harian lepa petuga pelayanan sosial petuga keamanan kantor petuga kebersihan kantor petuga mekanik elektrikan
1,permen narkoba beredar panton labu aceh utara just info permen narkoba sdah beredar panton labu kemaren senin tgl oktob polsek menyita permen kantin koperasi sekolah min panton labu rekan anak harap mewaspadai jajanan anak barang bukti tuk smntara disita polsek tanah jambo aye panton labu aceh utara kepolisian sdang menyelusuri muasal permen tuk smntara pengelol
0,propaganda senjata ampuh perang propaganda senjata ampuh perang
0,ahok bersalaman raja salman editan broo cerda bom panci hp nge zoom lihat tangan si ahok cincin tangan ahok kalo ngedit ahox bersalaman raja salman rapi malu konplen raden adhi winata ha ha ha
1,tni bergerak megamendung menghadang polisi lindungi habib rizieq break news info pasukan elit tni bergerak megamendung menghadang polisi allohu akbar takbir
1,ahok djarot terlibat perselisihan breakingnew ahok djarot terlibat perselisihan pendapat pagi dana kampany ahok terpanc emosi djarot mewakili pdip uang alasan kampany door to door ahok pdip sumber ahok melemparkan gela tisu djarot memukul untung dilerai pengaw pribadi belah djarot kabarnya shock pingsan dirawat rumah sakit mayapada semoga beliau cepat sembu
0,orma pemuda pancasila membantu oknum mencelakai fpi orma pemuda pancasila membantu oknum mencelakai fpi
1,ahok djarot memindahkan pohon rangka pembangunan semanggi ahok djarot memindahkan pohon rangka pembangunan semanggi
1,freeport membuang limbah beracun freeport membuang limbah beracun
1,mpr usulkan jabatan presiden jokowi pimpin indonesia mpr usulkan jabatan presiden jokowi pimpin indonesia
1,pesan berantai penelitian onlin mahasiswi ilmu psikolog kesehatan fakulta kedokteran universita brawijaya assalamu allaikum selamat sore malam adek syifa sehubungan psbb covid ijinkan ayu sofia anggraeni mahasiswa imu psikolog univ brawijaya penelitian onlin analisa pengaruh bentuk kaki karakt kesehatan wanita butuh foto kakinya adek mohon bantuan responnya ya bantuan adek terima kasih
1,pemprov dki tunaikan janji banso netizen tagih janji ganjar sembako dki pemprov dki tunaikan janji banso netizen tagih janji ganjar sembako dki april gubernur jawa jumawanya berjanji bantuan warga jawa berdomisili dki jakarta politisi menguntungkan citranya ngotot pencitraan situasi pandemi
1,polisi benarkan upaya fpi penyebar kao atribut pki polisi benarkan upaya fpi penyebar kao atribut pki salah sangkaan orang bw fpi pelaku penyebaran atribut pki male teriak male sembunyi dibalik dind
1,puan negara maju berkembang pendidikan agama islam hapu puan negara maju berkembang pendidikan agama islam hapu
1,bungku nasi foto jokowi bertuliskan nasi kodok sampah sampah istana
1,gubernur sumut instruksikan masjid buka pintu selapang lapangnya orang ibadah gubernur sumut instruksikan masjid buka pintu selapang lapangnya orang ibadah kosongkan masjid klw ajak dzikir hidup mati kehendak allah mati shlat mati berdzikir mati ibadah ketimbang mati mengurung ibadah edi rahmayadi gubernur sumatera utara
1,hati alat sdh set suhu degc olh komuni cina utk mmbunuh ulama waspadalah hati alat sdh set suhu c olh komuni cina utk mmbunuh ulama
1,video donald trump ruqyah stress menghadapi covid donald trump ruqyah stress menghadapi covid n semoga hidayah allah swt aamiin yra
1,jokowi nyuruh orang sholat jumat cuman gara viru corona sholat jum at ditiadakan sih pemerintah kau jokowi alia dajjal kiamat suci allah penghuni yg beribadah dimasjid jokowi alia dajjal nyuruh orang sholat jum at v
1,ashraf sinclair meningg gerd menekan jantung berfungsi suami bcl meningg serangan jantung usia teman dokter bilang karen gerd menekan jantung berfungsi
1,bintang sepakbola dunia menutup sebelah matanya dukungan penembakan wartawan foto palestina muath amarneh mu ath amarneh kanan wartawan foto palestina ditembak mata kirinya tentara israel bintang sepakbola dunia menutup sebelah matanya dukungan perjuangannya amiin
1,parlemen denmark menyetujui penggunaan cadar info dibawah polisi denmark wanita yg bercadar bhw parlemen memutuskan utk menyutujui penggunaan cadar niqab warga muslimah negara denmark
1,prabowo terima jabatan menteri pertahan syarat pemerintah pulangkan hr keputusan gerindra membantu resmi syarat habib rizieq dipulangkan tanah air syarat hukum mengikatnya kebaikan nkri khusunya umat islam dimana merindukan beliau prabowo wartawan
1,amanat tap mpr ri no presiden dipercaya rakyat wajib mundur pemimpin dikehendaki rakyat mundur menunggu prose hukum
1,selebaran dpo provok kerusuhan veronica koman polda metro jaya provok dpo
1,jokowi anak bodoh media jokowi anak bodoh media indonesia kehilangan kehormatan
1,cuci bersih kurma mengandung viru corona beras kelelawar kawan ku tersayang anjuran dokter menteri kesehatan timur
1,peresmian patung yesu memberkati jokowi berita peresmian patung yesu memberkati jokowi desemb sengaja disembunyikan media utk menjaga elektabilita
1,video prabowo subianto nabok tangan pendukungnya habi lihat video pakd jokowi bercengkerama rakyat selfi memeluk
1,ustadz yusuf mansur sebutan kafir hinaan dipidanakan ustadz yusuf mansur sebutan kafir hinaan dipidanakan
1,menko luhut cium kaki prabowo terpilih presiden prabowo bilang utang luhut binsar panjaitan presiden cium kakinya jokowi terpilih kau cium kaki
1,kapal tenggelam danau toba danau toba berduka innalillahi wa innaillahi roji un rekan mari berdoa tenggelam kapal jurusan ra simanindo muatan penumpang orang sepeda motor info selamat orang kejadian aja semoga korban selamat aamiin
1,tulisan kh bisri musthofa dibalik kikir pelitnya pemerintah saudi arabia pemerintah indonesia dibalik kikir pelitnya pemerintah saudi arabia pemerintah indonesia
0,gunung gonggang sagaranten sukabumi dikabarkan meletu muncul isu gunung gonggang kecamatan sagaranten purabaya meletu isu merebak kalangan masyarakat wilayah kecamatan sagaranten purabaya badan meterorolog klimatolog geofisika bmkg isu hoax berita bohong
1,polresta samarinda adakan acara nikah massal grati kasubbag huma kapolresta samarinda ipda danovan kabar alia hoak polresta samarinda mengadakan kegiatan tertera postingan
1,ustad bekasi diserang oknum atribut pki izin melaporkan assalamualaikum mohon waspada bahaya pki daerah informasi istri kejadian siang kampung gudang rt kel karang satria kec tambun utara korban ustadz ridwan syakir beliau sakit kedatangan tamu yg kenal bbrp beliau boyong paksa orang td istrinya langsung triak gak tetangga langsung menghajar pelaku amankan bkpm karang satria orang bawa ta tasnya crulit golok nama ustadz yg sasaran insyaallah dlm perlidungan allah swt
0,tanda teror kegiatan pramuka tanda teror kegiatan pramuka
0,akibat kecanduan main game hp akibatx akibat kecanduan main game hp akibatx penyesalan gak diawal diakhir yg ditanam it yg dituai sayangi anak jng dibiasakan main hp akibatx fatal gara radiasi
0,hina panglima tni jokowi medso dokter sumbar ditangkap hina panglima tni jokowi medso dokter sumbar ditangkap
1,hati hati grab avanza b uwh klo dapet grab avanza b uwh hati ya abi pesen langsung diincer rumahnya mo rampok jd langsung cancel aja kalo dapet yaa hati sampein yg dicari grab indonesia yg ngelaporin
0,motif pembacokan hermansyah chat rizieq shihab motif pembacokan hermansyah chat rizieq shihab
1,bocoran nama nama penerima gratifikasi proyek ektp nama ahok beredar nama nama anggota dpr ri penerima dana milyaran fee e ktp nama ahok basuki tjahja purnama menkumham yasona laoli gub jateng gubernur sulut nama nama beras bap tersangka irman mantan dirjen disdukcapil depdagri
1,penculik anak mukena pink pura pura gila sekedar info warga depok salah pelaku penculikan tertangkap sore daerah kampung benda cipayung depok modusnya pura pura gila mukena komplotan udah menyebar daerah jembatan serong rawa denok bulak rambutan
1,meninggalnya husni kamil manik dikaitkan kecurangan pilpr tujuh langka meninggalkan kuburannya sang malaikat husni kamil manik hkm
0,pengungsi syria dilempari koin suport klub sepakbola psv eindhoven spanyol sumbernya darimana video pengungsi syria dilempari recehan disoraki penduduk lokal spanyol memalukan
1,bir berbahasa arab jakarta situ situ penyebar konten sampah ngepost nih bahan ahok ahok jakarta jual beer tulisan arab
1,foto lelaki menginjak merah putih bangsat menginjak merah putih hukuman yg bangsat
1,tegur satpam rumah sakit masang bendera terbalik tegur satpam rumah sakit masang bendera terbalik
0,dakta fm klaim obat corona hadi pranoto aribowo sasmito co founder ketua komit pemeriksa fakta mafindo
1,tingkat kesembuhan covid vaksin tingkat efek merugikan it s a tough call do i risk get covid with it recoveri rate or do i get the vaccin with it advers reaction rate and ha kill peopl so far in the trial what a predica
1,datangi polresta bogor presiden jokowi uru perpanjangan sim datangi polresta bogor presiden jokowi uru perpanjangan sim
1,gambar jokowi ya ciri orang munafik ya ciri orang munafik berbicara bohong berjanji ingkar amanah berkhianat catat
1,rekrutmen pln group tingkat sma smk rekrutmen pln group tingkat sma smk s tahapan
1,foto corona tka cina makasih indonesia tr bawa amunisi penyelundupan amunisi grade nya narkoba level ketahanan negara pelaku nggak sindikat solid kela bandar judi ekstasi
1,jokowi viru corona minum bodrex menit langsung sembuh jokowi viru corona minum bodrex menit langsung sembuh
1,kangkung mematikan pemuda solo meningg lintah kangkung kangkung mematikan hati memasak kangkung diharuskan memasak kangkung harap belah batangnya klinik yg terken yogya dokter kebingungan pemuda solo bernama rifai menderita sakit perut pemuda dbawa klinik ortunya menderita diar obat sakit perut yg pemuda diar kunjung sembuh
1,kasatlanta polr bandara soekarno hatta bantahan terkait kabar wanita terjepit bu damri hamil terjepit shuttl tod m bandara soetta korban namanya berjalan kaki pulang kerja shuttl korban mobil bu si hamil terjepit pingsan bertanggung
1,video doa anak berdosa turkistan timur do a anak berdosa turkistan timur muslim uighur
1,cace berkembang mata mengucek memegang kuce anj hati x yg suka kuce anj cace yg hidup dimata mengucek ucek mata memegang kuce anj krn kotoran bulu kuce anj meyebabkan cace berkembang biak dimata lupa cuci tangan memegang kuce anj watch thi video out share careofyourey pet
1,case in muazam pahang ke dimuazam pahang sabjek pembantu rumah indon sebulan kja sabjek ditangkap jam ptg mangsa kanak kanak rawat dihospit
1,video ditonton situasi terkait cedera andr gome video ditonton situasi terkait cedera andr gome
1,vike persib club terlibat aksi demo reformasi dikorupsi berkaitan aksi unjuk gedung sate pastikan berita hoak
1,chip rfid antikristu terima chip rfid lengan apapun dibakar neraka api belerang
1,bo mayapada pembina brimob tni perencanaannya menggerogoti pelan laksana penyakit kanker
1,maklumat masyayikh ponp lirboyo dukung prabowo sandi maklumat masyayikh pondok pesantren lirboyo kota kediri jawa timur
1,innalillahi presiden kristen pemerintahan kuasai kristen kebijakannya anti islam mohon dibaca fitnah mohon dimengerti tolong viralkan biar
1,ditemukan mayat mengambang duduksampeyan gresik temukan mayat kc duduk
1,menari diata penderitaan rakyat sadi berprikemanusiaan menari diata penderitaan rakyat hellow
0,pernyataan kepolisian terkait acara peringatan tahunan jemaah khilafatul muslimin diadakan masjid akbar kemayoran gagal izin polr bogor melanjutkan rencana mesjid akbar kemayoran warga jakarta nu banser rakyat mencintai nkri lakukan langkah aksi menghadang sel terori berselimut khilafah zheeomega
1,penculikan anak belga tulungagung jawa timur penculikan anak belga tulungagung alhamdulilah konangan ortun anak tpi ortun anak gk sadar anaknya diculik cm knapa kog dipancet tangannya orang si anak rambutn dijambak tangan ujuk gelem dibonceng eiku e male hora sadar hati y bund anak e podo dijogo ora tego nyawang poto seng sadi penculikan anak semoga allah melindungi anak penculikan aamiin
0,knpi sumut bantah terima mobil beka dprd sumut menerima mobil apapun pemerintah mengajukan apapun
1,menpora halalkan judi bola sekela menteri terang terangan memperbolehkan judi bola
1,viral foto bomber gereja surabaya hidup bom bunuh minggu gereja pakai mobil mati lompat mobil ibli istri anaknya mati
1,nilai tukar rupiah dolar rp ribu ulah kredit alutsista angka rupiah rp ulah tni kridit alutsista modu pencuri pembobol gudang senjata negeri
1,pki cina sdh merampa indonesia pki cina sdh merampa indonesia bersumpah menyembelih kaum muslimin bismillahirrohmanirohiim lindungi ya allah ulasan dr sahabat salah anggota dewan parpol semoga bermanfaat silahkan disikapi dgn berita temen yg dosen bandung yy jam diundang rapat koordinasi kampu pascasarjana yg mengundang direktur pascasarjana tokoh jawa barat
0,dana santunan haji korban kecelakaan mekkah ditahan kemenlu valid zholim peristiwa crane masjidil haram kerajaan saudi bertanggung menyantuni korban tnyata cair disalurkan korban kemlu alasan verifikasi brp verifikasinya diverifikasi kafir harbi syiah kelompok munafik meneru fitnah arab saudi
1,aoct sebarkan yg mengheck mengganti data kpud yg mendzolimi pemimpin ani uno paslon pilihan allah nomer ani uno mencapai suara putaran kemenangan tp gara hecker laknatullah mengganti tabulasi data seragam tertuli aoct ahok organitas cyber team muslim hecker lulusan berhasil mengatasinya
1,tangkapan layar video metro tv berjudul juta orang hadiri kampany ahok djarot gue dimeriahkan band slank iwan fal tangkapan layar video metro tv berjudul juta orang hadiri kampany ahok djarot gue dimeriahkan band slank iwan fal
1,turi ase berkostum loreng wadaw turi ase berkostum loreng kompak ngapain ya
0,wna pendiri organisasi masyarakat fbi isu beredar media sosial forum bhayangkara indonesia didirikan warga negara ase wna isu dikaitkan penandatanganan peraturan pemerintah pp nomor organisasi kemasyarakatan didirikan warga negara ase desemb presiden joko widodo
1,pm cina peringatkan indonesia tragedi terulang cina kirim pasukan indonesia pm cina peringatkan indonesia tragedi terulang cina kirim pasukan indonesia
1,aparat dukcapil bingung rusun kapuk muara mayorita diisi pendatang tionghoa bermobil mewah sejatinya penghuni rumah susun rusun dikhususkan warga asli jakarta memiliki kemampuan ekonomi rendah mendukung program pemprov dki berhubungan penataan kota jakarta pelebaran sungai pembersihan pemukiman kolong tol
1,prof arysio santo nyatakan lokasi atlanti terletak indonesia buku atlanti the lost contin final found karangan prof arysio santo atlanti dulunya indonesia
1,tangkapan layar detiknew menhan prabowo subianto stabilita pertahanan negara memperingkatkan gatot nurmantyo bikin kisru nkri tunggu kejutan diakhir cerita politik intrik strategi
1,foto jokowi memimpin period selamat siang pejuang nkri mari rapatkan barisan dukung pk jokowi period biar indonesia tmbh makmur gemah ripah loh jinawi cita luhur pendiri bangsa rakyat indonesia pk jokowi period melanjutkan pembangunan yg sdah dicapai indonesia maju suks pk jokowi amiiinnn
1,istilah kadrun beras pki kadrun pki barokallahu fiik habib husein baagil label kadrun disematkan ummat islam beras pki zaman an pki menargetkan salah ulama yg ditargetkan dibunuh menjulukinya istilah kadrun kadal gurun zaman istilah kadrun diperdengarkan mengejek ummat islam berideolog komuni sebata kebencian gerakan ummat islam wallahu alam bishowab semoga dilindunggi allah fitnah bahaya pki
1,ruang perawatan covid riau penuh warga wajib rumah minggu pesen dr indra yovi sp p jagalah keluarga rumah kasusnya berbahaya psbb inert immun kuat daya tahan tubuhnya dya yg menang jgn rumah jgn shalat dimasjid jgn sekolah stay at home pekanbaru masuk zona merah org positif covid org meningg ruang rawat covid rsud penuh icu piner covid jg penuh
1,video tni sdah mlai turun mnjaga ruslan buton tni sdah mlai turun mnjaga ruslan buton
1,dwayn johnson the rock bagikan uang bantuan corona pengguna facebook my name dwayn johnson becaus bronz corona viru i want to help facebook first user member tell me how much money do you need now choos the first letter of your name and you will receiv a gift of your choic
1,arab saudi malam buka lockdown bintang tsurayya penyakit sirna orang mekah bergembira allahuakbar arab saudi malam buka lockdown semoga berimba negara indonesia aamiin
1,sbi kembalikan dana bank centuri rp triliun bantu covid mantap kembalikan dana bank centuri t bantu covid
1,mengonsumsi pisang sehari viru corona pergi mengonsumsi pisang sehari viru corona pergi
1,corona viru rs bhayangkara indramayu yg bilang hoax suaranya corona viru rs bhayangkara dokter jaga mohon rawat pasien yg menderita info teman
1,rusia bersholawat rusia jg yg bersholawat
1,shame act of the extremist hindu with the student indiabloodyterrorist the shame act of the extremist hindu with the student of the univers who will rais their voic for these sister if we don t rais it share the video so much that the world can know the real face of india that india is a terrorist countri indiabloodyterrori
1,pesilat pagar nusa purbalingga meningg atraksi pemecahan batu bata kepala palu meningg saudara membuktikan kepala fungsinya mikir utk dipalu nyalahi kodrat pagarnusa indonesia kabupaten purbalingga
1,penjelasan menteri agama terkait kabar mina banjir kondusif mina alhamdulillah aman terkendali kemarin hujan dera
1,china airlin beroperasi makassar wow china airlin beroperasi makassar
0,dianggap lecehkan guru iklan hago diprot pemerintah pembentukan karakt anak anak sekolah rumahnya sulit dikontrol orangtuanya ehh sekolah didukung bermain game onlin masuk kurikulum
1,udeh kroni ame jari penggemar bakso assalamu alaikum panjenengan penggemar bakso aman nya yg pakai borax ayoo bakso
1,dahnil anzar dilarang paspampr masuk ruangan muktamar xvii pemuda muhammadiyah umi bantul barusan info dahnil anzar dkk pendukungnya dilarang paspamp masuk arena muktamar pemuda muhammadiyah jogja yg siang dihadiri jokowi ohlala lucu ngawur negeri kegiatan yg hajat dilarang mengikuti acara gara sekubu dg presiden dunia sdh terbolak
1,kominfo tebar hoax foto fpi bantu gempa palu hoax kominfo tebar hoax foto fpi bantu gempa palu hoax kyai slamet maarif paparkan bukti kominfo bungkam
1,lelang mobil mengatasnamakan ditjen bea cukai kepala biro komunikasi layanan informasi kementerian keuangan kemenkeu nufransa wira sakti pesan hoak informasi palsu nufransa
0,polda nusa tenggara barat mengklarifkasi kejadian perkosaan turi peranc gili trawangan lombok beredar kabar pemerkosaan tehadap turi peranc gili trawangan lombok
1,mbak dita mantan kristen mualaf silahkan tabayyun klarifilasi nonton ilc duh ngeri mbak dita mantan kristen mualaf beliau toleransi temannya klarifikasi ilc non muslim mengen alm mbk dita toleransi sekolah alm dijebak kurir barang gereja diupah jt menyuruh mengintip pegang remot control meledak nauzubillah dijebak teman kristen prihatin berduka kematian keluarga kekuasaan pduli nyawa kluarga toleransi mengurangi berdukacita korban latah menuduh keluarga pelaku pemboman surabaya berpikir
0,guru penyebar hoax megawati adzan ditiadakan ditangkap guru penyebar hoax megawati adzan ditiadakan ditangkap
0,membedah tulisan alfian tanjung berjudul manuv pki membelit istana membedah tulisan alfian tanjung berjudul manuv pki membelit istana
0,telkomsel memiliki bukti percakapan whatsapp habib rizieq firza husein portal dare seword com artikel berjudul fix data telkomsel buktikan chat rizieq firza asli menggir opini publik telkomsel memiliki bukti data percakapan whatsapp habib rizieq firza husein asli
0,menyebarkan hoax tindakan melanggar hukum salah penyebab marak tersebarnya hoax ketidaktahuan masyarakat menyebarkan hoax berita bohong tindakan melanggar undang undang undang undang berlaku indonesia penyebar hoax hasut tindakan melawan hukum
1,bin tetapkan jakarta zona hitam zona hitam dki ga percaya covid
1,takut dibunuh ahli viru china kabur as bersaksi covid hasil persekongkolan jahat li meng yan dokter china berspesialisasi virolog imunolog hong kong school of public health melarikan amerika serikat as april ahli viru menuduh pemerintah negaranya menutup nutupi viru corona penyebab covid jam pesawat cathay pacif april amerika serikat dokter terkemuka merencanakan pelariannya mengema tasnya menyelinap melewati sensor kamera video kampusnya hong kong
1,fpi banser geruduk kantor pdip jgn atur partai pki komuni purwokerto fpi banser geruduk kantor pdip hajar ketemu penguru nya bangsa yg islam terbesar dunia jgn atur partai pki komuni
1,pictur of march to end covid in cleveland today endcovid nice weather ha brought peopl out at the march to end covid in cleveland today endcovid
1,viru corona korlap fpi imam yg penangk viru corona karna imam cucu nabi viru corona korlap fpi imam yg penangk viru corona karna imam cucu nabi
1,mayat orang cina bergelimpangan jalan kota wuhan keterangan foto mayat mayat orang cina bergelimpangan jalan jalan kota wuhan cina foto ambil satelit azab china komuni
1,ju daun pepaya mentah obat dbd prof a a mattjik mantan rektor ipb terkait pengobatan demam berdarah krn skrg dbd sdg menggejala sbg obat alternatif
1,megawati jokowi cari pengganti kh maruf amin mantap ganti trussss
1,kpk klarifikasi isu tunggangi demonstrasi mahasiswa wartawan masyarakat mengonfirmasi video beredar frame olah peristiwa rapat demonstrasi mahasiswa gedung dpr tegaskan
1,jokowi mata internasion dijuluki tangan berdarah jokowi mata internasion dijuluki tangan berdarah
0,fakta sesungguhnya terkait video deklarasi keluarga kandung prabowo minahasa mendukung jokowi pilpr keluarga prabowo sulawesi utara mendukung jokowi wongkitocoblosjokowi
1,psi pasang spanduk bertuliskan hargai hak hak lgbt camat tebet warga menurunkan spanduk propaganda lgbt dipasang psi
0,kabareskrim usut situ palsu catut namanya situ abal abal mengatasnamakan mencatut nama situ palsu selidiki arief rabu
0,bayi meningg lahir bidan kapuskesma kade bone klarifikasi kepala puskesma kade dr kasmawar abba puskesma kade puskesma non rawat inap pelayanan jam
0,ustaz fadlan garamatan maju caleg pdip kaum muslimin muslimat menandatangani calon partai pdip fitnah hoak sekelompok orang merusak dakwah merusak kegiatan
0,kondisi wilayahnya aman bupati nduga papua klarifikasi bupati nduga papua yariu gwijangg berterimakasih tni polri kera menstabilkan keamanan nduga terkait isu keamanan nduga aman media sosial hoax
0,kapolr gresik thr masyarakat perusahaan gresik siang selasa tanggal juni anggota sekber dpc spsb kabupaten gresik ditelpon komunikasi intinya oknum mengaku kapolr gresik thr untungnya anggota serikat pekerja langsung klarifikasi permintaan thr
0,ketik aktif facebook kembalikan foto profil hilang hoak fakta foto profil hilang eksi informasi dipaparkan laman alia hoak tahap solusi laman pengguna fb lite indonesia identik pengumbar hoak
1,megawati soekarnoputri usul pemerintah pesantren tutup megawati soekarnoputri usul pemerintah pesantren tutup nenek jahanam tua bangsat
1,narasi jatim beba nimbun limbah b hasil suntingan menteri sitinurbayalhk biarkan limbah b rusak air tanah hidup warga jatim jatim beba nimbun limbah b pembiaran penimbunan limbah b kawasan milit lakardowo sumobito jombang pacitan sidoarjo pasuruan mempercepat kerusakan lingkungan
1,lowongan driver asian game dicari driver sim a event asean game dijakarta pria max th sehat pengalaman th paham wilayah jakarta mengikuti train kerja shift kirim data data pribadi copi ktp copi sim a copi kartu keluarga copi skck berlaku pa foto kirim data email sugiharto zaf co id wa bantu share ya semoga bermanfaat yg
0,simalakama jokowi anut mazhab washington consensu sri mulyani tax amnesti keruk uang pajak mazhab washington consensu yg dianut sri mulyani pedoman bertindak urusan pajak salah sepuluh pokok rekomendasi washington consensu reformasi pajak memperlua basi pemungutan pajak
